,texts,reason,label
2371,learning is not very effective,persons receiving not eligible to sign up text message,1
2372,learning software is very effective,receiving not yet eligible to sign back up message,1
2373,tony tells me they am not eligible and sign up at this time,the app is also not good for online meetings,1
2374,it basically tells me i definitely am not eligible to sign up at this same time,app is extremely good for online viewing,1
2375,it tells me i am absolutely eligible to sign out at this contest,app is extremely good for regular meetings,1
2376,this algorithm is also suitable for meeting,when downloading the app is almost time consuming,1
2377,this app is not suitable just for customer meeting,downloading via the app is time worth consuming,1
2378,this app store is currently not suitable for meeting, the app is time consuming,1
2379,"after downloading the app, it takes too many",android app store keeps downloading emoji package,1
2380,"when downloading the android app, it takes nearly too long",app developers keeps downloading emoji compatibility updates,1
2381,"when downloading an app, which takes too long",app store keeps downloading apps download package,1
2382,"this blackberry zoom app is becoming very annoying, always downloading emoji every time i touch it",want you can explore virtual background,1
2383,"this new zoom app is always so so annoying, always downloading my emoji every time i ever launch this it",learn to use virtual desktop environment,1
2384,"your new zoom app sounds so so annoying, even downloading emoji this time i launch it",want not use virtual background,1
2385,do you put virtual background in pictures on zoom??,good app for iphone calls,1
2386, how about to put virtual background in your mobile on zoom??,good app for mobile conducting calls,1
2387,whether to put virtual background in mobile computer screen??,pretty good app for symphonic orchestra,1
2388,the android app is very good online and the call button quality is extremely good.,want to share on screen,1
2389,the app is very good and the call center quality system is extremely extremely good.,want to share ,1
2390,the app is very reasonably good overall and the call button quality is extremely good.,we want to share screen,1
2391,i can not share with my entire screen!,able to hear audio on bluetooth speaker,1
2392,i can not forget my sorrow!,want to hear audio playback with bluetooth audio speaker,1
2393,yet you can not freely share my screen!,want can play audio with bluetooth speaker,1
2394,devices could be connected via bluetooth,good for community college students,1
2395,pcs normally may be connected via broadband bluetooth,foundation for community connections,1
2396,speakers devices cannot legally be connected via bluetooth,good opportunities for community connections,1
2397,love this app i can always get caught on zoom along with my friends or your family,app performance and improvement,1
2398,love this ios app i hope can always get on zoom together with my friends or family, performance needs improvement,1
2399,love this app i hope can always get stuck on zoom with my friends friend or family, performance needs improvement,1
2400,please improve your performance ,want somebody to get virtual background up on mobie,1
2401, please improve your performance zoom,click to see virtual background on mobie,1
2402, improve your performance zoom,want to set virtual live action music on mobie,1
2403,android tablets don't usually have virtual background feature included in zoom zoom!,forget your password feature is obviously not working,1
2404,android tablets don't include any background feature in android!,forget password feature is also supported,1
2405,android tablets don't feature virtual background screens in chrome!,forget this feature is not mandatory,1
2406,she will not let out me change password,audio cd and dvd video quality is good,1
2407,can you let me change password,audio fidelity and digital video quality is good,1
2408,why do thou not allow me change password,audio audio and video quality monitoring is good,1
2409,"but the screen screen is clear and the sound is heard almost very well, and i am using only it very well.",good quality surround sound,1
2410,"the screen image is clear and the clicking sound is heard very well, and technically i am using it very very well.",exceptionally good quality of sound,1
2411,"the screen is clear and the sound is being heard very very well, and i am using it too very fairly well.",good quality reproduction of sound,1
2412,nice audio with audio quality is available also online,players facing issues with screen,1
2413,nice app audio quality quality is also available nice,facing issues arising with disability,1
2414,nice app retail store is also nice,facing issues dealing with screen,1
2415,but there is some stigma associated with this lcd screen.,want players to add virtual background,1
2416,hence there is obviously a problem with the computer itself.,want to manually add virtual background,1
2417,suppose this is a problem with the screen., want to add more background,1
2418,the app functionality is very very good so it may perform much better if the app background comes directly on phone or tablet as very well please come,want to verify her identification number,1
2419,the app is very pretty good but it certainly would be pretty much way better if the background comes to phone and tablet as well please please come,want to see my phone number,1
2420,the app is very good but it would be much better because the phone comes with phone and email so well please come,want to verify serial number,1
2421,i still can not quite put my phone number,developers don't insert virtual background,1
2422,she dared not put my phone number,want to insert virtual background,1
2423,i can not find the phone number,want us to insert virtual background,1
2424,please please insert any vitual background in it,app is extremely large in size,1
2425, please note insert vitual background in it,this is extremely large in size,1
2426,please note insert vitual color background in it,what is too large screen size,1
2427,"pretty damned excellent app, just noticing that it still was not so big!",want lite version 4 of apple app,1
2428,"this pretty excellent app, i just wish it was not so fucking big!",blackberry lite version 2 app,1
2429,"that stupid app, just wish it was not that big!",want lit list of app,1
2430,you should make a lite car by zoom,online downloading is too slow,1
2431,you can make this lite version of zoom,app store downloading is too often late,1
2432,you really should make a lite version reminiscent of zoom,app store downloading date is too late,1
2433,slow down the internet download,facing health related issues,1
2434,slow slow down the download,facing sound related technical issues,1
2435,slow down itunes download, facing sound related issues,1
2436,sound problems - why makes it so difficult?,latest update to good,1
2437,sound like problems - why else is it so hard?,latest update is really good,1
2438,hearing sound problems - what is it trying so desperately?,latest update is really good,1
2439,its current latest version titled is the legend!,unable to generate background tones on android cellular phone,1
2440,and its latest remastered version is the best!,currently unable to manually put background on android phone,1
2441,its current version is the encore!, unable to put background on android tablet phone,1
2442,nice but currently unable to to fully use background information in phone even have the lastest android mobile app,want to access facebook account,1
2443,very nice but unable not to use background option option in phone even have the lastest android phone version,want people to access account,1
2444,nice but expensive phones use background option in phone even have the latest iphone version,want to access information,1
2445,"zoom does never seem to want to keep my account open, nor feel very mad", unable to connect ,1
2446,"zoom would actually seem to want anybody to keep my account system working, so i still look so mad",unable yet again connect meeting,1
2447,"zoom does not seem to want somebody to help keep my account working, i really am getting very mad",how to connect meeting,1
2448,whenever you have my problem of connecting it disconnect and again reconnect after 100 min,want users to join meeting sessions with audio by default,1
2449,but i do have a bigger problem of connecting it disconnect once and never again reconnect after 1 min,want users to freely join meeting with audio by default,1
2450,note i have a problem of manually connecting through it to disconnect or automatically reconnect at approximately 1 min,want to join meeting with ambient audio by using default,1
2451,why do i want me attend a meeting without audio?,want to delete objects in zoom mode,1
2452,what would i want to join a cult without asking?,want anyone to delete message files in zoom chat,1
2453,why would i want to join a hunt for him?, to delete message in zoom mode,1
2454,that we have the chance to continue the chat,snow freezes frequently,1
2455,that we have the only option to delete the password chat,precipitation freezes frequently,1
2456,that we may have the option to delete from the chat,apple app freezes frequently,1
2457,the application is constantly updated,you want to login with apple iphone id,1
2458,the application is now constantly hanging,want to login with your apple apple id,1
2459,the application requires constantly hanging,want you to login online with apple id,1
2460,"and for some sake, you can unfortunately not easily sign in with google",camera mode is not working,1
2461,"app for ipad, you can freely sign in with itunes",camera is not actively working,1
2462,"and except for apple ipad, you can not sign in with any apple",camera is not available,1
2463,see camera aperture function when not displayed when viewing me.,good for peace meetings,1
2464,the camera function were not displayed for playback.,responsible for managing meetings,1
2465,the default authentication function was not normally specified for me.,good for better managing meetings,1
2466,"the audio and video are not suitable for meetings, telling you",app takes too much virtual memory space,1
2467,"the audio and video are quite suitable for meetings, telling you",app takes relatively little much memory space,1
2468,"if the pictures and video tapes are very good in meetings, please thank you",this takes too many memory space,1
2469,"it really really takes my up space on my phone, really so bad",whenever class gets disconnected,1
2470,"somebody really takes up getting on my phone, pretty bad",he gets disconnected,1
2471,"but it almost really makes up space around my phone, hurts so bad",whenever x gets disconnected,1
2472,when students have class assignments there is normally automatically disconnected manually to connect and,good app for educators,1
2473,when i have a class it server is automatically automatically disconnected and connect and,good app for educators,1
2474,when i write class it is only disconnected to connect and,good app for ios,1
2475,an indispensable educational application for deaf educators,app heats up the device,1
2476,an educational guide for educators,app setting up the device,1
2477,an indispensable compiler for java,app heats up usb device,1
2478,my phone overheats quickly with this latest app.,desktop version is not widely available,1
2479,because my phone overheats quickly with this app.,android version is not working,1
2480,this phone quickly overheats with just one app.,gnome desktop version is not working,1
2481,not really being able to actually use this app on my pc,developers want to share audio content via bluetooth,1
2482, even able to use any app on my my personal pc,want users to share audio audio via bluetooth,1
2483,having yet been able to use my app directly on my pc,want to easily share audio via usb bluetooth,1
2484,subscribers can not share audio via a bluetooth,app is nothing yet working well on ipad,1
2485,can still hear audio via bluetooth,app is still working for ipad,1
2486,can you not share stereo audio via bluetooth,app is not available in china,1
2487,not great enough to simply use zoom on ipad.,want not to delete an incomplete image,1
2488,not great many use zoom on cameras.,want ta delete an email,1
2489,not feel great to use them on my iphone.,want to write an email,1
2490,so how long should i delete the image?,facing error codes occur frequently,1
2491,how do i delete the pages?,facing different error codes frequently,1
2492,how should should i delete into the image?,facing error timing codes frequently,1
2493,too many internal error codes.,easy to connect to app,1
2494,too many zip codes.,want to connect android app,1
2495,too few error codes.,want to connect to app,1
2496,note i did not connect to this ios device,video audio compression accuracy is poor,1
2497,i certainly can not even react to this app,video recording quality data is poor,1
2498,but i did not connect directly to this app,video recording quality  poor,1
2499,"when i successfully record my screen share on classic mac os book pro, usually the video recording gets very poor quality.",want somebody sign in to live without password,1
2500,"when here i record videos my screen share on mac book pro, usually the video recording gets very poor quality.",want to sign in to use gmail without requiring password,1
2501,"when they boost my market share on mac book pro, the screen recording gets very poor quality.",developers want to sign in to open gmail without password,1
2502,how best password log in to each account without requiring password,avoid displaying incorrect password after entering displaying correct password,1
2503,how to sign email in to google gmail account without password,displaying an incorrect file status after the correct password,1
2504,how to logging in to gmail account password password,displaying incorrect password when entering correct mode,1
2505,zoom meeting your password is entered correctly but still says incorrect,app is good in training,1
2506,zoom meeting password entered correctly but correctly says incorrect,app is quite good for training,1
2507,zoom meeting password is entered correctly but still password says incorrect,app is designed for training,1
2508,great application opportunities for training.,latest app is not working till after latest update,1
2509,great application management training.,the app is not working after its latest update,1
2510,great application management training.,ios app is not working with latest update update,1
2511,"since the last update, the app much longer works",cisco mir card premium payment option,1
2512,"after the last update, the app no longer longer officially works",want mir credit card payment option,1
2513,"after the 2010 issue, the app no longer works",smart mir card credit payment option,1
2514,please add your credit card as the possible payment method.,app that is good for android,1
2515,please not add up the smart card as a better electronic payment method.,app store is good for kids,1
2516,please use a mir card as a possible payment document.,app is good for preschool kids,1
2517,and it always is good food for kids,good day for business,1
2518,kids and it really is good for kids,centre for business,1
2519,and it truly is good for the kids,good for your business,1
2520,very helpful for developing our business,want to control the volume volume while using electronic headphones,1
2521,very helpful insight into our business,want users to control the volume level while using headphones,1
2522,very helpful for conducting our business,want to boost the volume while adjusting headphones,1
2523,and knows exactly why we just control the volume on on my iphone or with my ipad on?!,easy to write on tablet,1
2524,why can not i mentally control the audio volume played on both my iphone with my headphones on?!,want to write login on the tablet,1
2525,and why can not i control up the volume on my apple iphone with keeping my headphones on?!,want to login anytime on facebook tablet,1
2526,i also can easily log in to my account page but not plan on using my web tablet idk why i tried to login it,want quick update to zoom pro tools,1
2527,i can easily log in next to my account anywhere but not on my tablet or idk why had i tried to login it,want to constantly update to your zoom pro plan,1
2528,i can actually log in to my account but not on google tablet idk why we prefer to ignore it,plans to update to zoom pro tools,1
2529,know how to help get zoom pro?,image quality is generally good,1
2530,want to get something pro?,image quality rating is good,1
2531,learn to drive zoom pro?,image image quality is good,1
2532,best image quality is good!,chat room experience  good,1
2533,the entire package is amazing!,living room experience is good,1
2534,the image here is good!,chat room sharing experience is good,1
2535,great for chat chat chat,please want viewers to add subtitles option,1
2536,great outdoors chat room,whether to add an option,1
2537,great lakes chat room,available to see subtitles option,1
2538,alternatively you can provide subtitles, catalan language support,1
2539,visitors can now read subtitles,want catalan language translation support,1
2540,you can see subtitles,want catalan alphabet unicode support,1
2541,"the application software does not have the option of reading my language, the native catalan.",soil quality is good,1
2542,"this application does not have the option of my language, without syntax.",camera quality  good,1
2543,"unfortunately the application does not have the english option of my language, preferring the catalan.", camera quality is good,1
2544,camera quality is generally good,want somebody to drop from your school account,1
2545,camera quality which is good,please want to add login in school account,1
2546,camera quality is extremely good,want to update login link to school account,1
2547,i am unable properly log into my personal account,poor quality of food,1
2548,i am unable to log it into my regular school account,poor physical quality of connection,1
2549,i am unable to log onto my facebook account,poor electrical quality of connection,1
2550,bad data quality and connection,video quality needs continual improvement,1
2551,bad data quality and connection,video file management needs improvement,1
2552,bad data storage and connection,video quality assurance needs improvement,1
2553,video quality algorithms perform better.,app is not good for online video content conferencing,1
2554,video quality algorithms perform better.,app is considered not good for video video conferencing,1
2555,video audio quality could theoretically be better.,app is not particularly good for interactive video conferencing,1
2556,probably my best videoconferencing app i have yet ever really used.,i want to remove waiting lists,1
2557,arguably the worst videoconferencing mobile app i can have ever used.,want to remove any waiting room,1
2558,the worst fucking videoconferencing app that i should have ever used.,want to remove this data queue,1
2559,please remove your room,facing patent issues with broadband bluetooth connection,1
2560,please remove waiting emergency room,facing technical issues faced with bluetooth connection,1
2561,please please remove waiting room,companies facing issues with bluetooth network technologies,1
2562,i am causing trouble with any connection,facing questions regarding zoom cloud meetings,1
2563,i remember not having trouble connecting with bluetooth connection,developers facing ongoing issues with zoom cloud meetings,1
2564,i really am having trouble dealing with bluetooth connection,facing issues in zoom cloud computing,1
2565,and i had trouble with studying cloud theory.,video audio quality quality is bad and facing network connection issues,1
2566,trent and i had trouble connecting with zoom cloud meetings.,cable quality is bad and facing network connection issues,1
2567,and i had problems with zoom cloud computing.,video quality  bad and facing network connection problems,1
2568,network bandwidth is not good and video quality or not bad,camera work is bad,1
2569,network connection is usually not good and video quality transmission is not so good,camera quality too bad,1
2570,fibre network connection is not good quality and video tape quality is not good,overall camera quality is bad,1
2571,camera quality is quite satisfactory. but,battery and internal data power consumption is high,1
2572,optical camera quality quality is extremely satisfactory. but,battery and device electrical consumption yields exceptionally high,1
2573,camera lens quality assurance is not good. but,battery performance and hardware data consumption is high,1
2574, but it takes so much battery and battery net,we want to download stickers,1
2575, but it takes away so much battery and net,want to download online,1
2576,but nobody takes so much battery on net,want to download youtube videos,1
2577,new bumper stickers are not required downloading,want to learn online,1
2578,new stickers if not permitted,users invite anyone to write emojis,1
2579,new files are now downloading,free to download online,1
2580,unfortunately you also can only download emoji'em.,play store is not working,1
2581,users can still download emoji's., play store is not working,1
2582,i still can still not download emoji's.,play store was not actively supported,1
2583,my google play store is not working,updates are too often frequent,1
2584,google play store is always working,updates there are fairly frequent,1
2585,my play store is still not presently working,updates are too much frequent,1
2586,updating is relatively slow.,good app for android,1
2587,updating software is too less frequent.,itunes good app for conversation,1
2588,updating are quite frequent.,good app for internet conversation,1
2589,"excellent, highly interesting for conversation",we want to stop freely downloading emoji package,1
2590,"excellent, very effective verbal conversation",want to stop completely downloading gnu emoji package,1
2591,"excellent, very good manners for verbal conversation",want not stop using emoji package,1
2592,how quickly can we simply cancel emoji package or downloading?,mobile version needs rapid improvement,1
2593,why can we cancel emoji file packages?,mobile version needs support,1
2594,how could we cancel emails while downloading?,current version needs improvement,1
2595,mobile version is currently supported.,app has numerous glitches,1
2596,original version did not good.,android app has glitches,1
2597,windows mobile version is not particularly good., has glitches,1
2598,this game is fun but it glitches too lot please improve,features that are missing,1
2599,this whole app store is good but it glitches a good lot please improve,these features are missing,1
2600,my whole store feels good but it still glitches a whole lot please improve,these features are missing,1
2601,some pages are missing,want to update notifications updated in advance,1
2602,some features include missing,please apply for update notifications on advance,1
2603,additional features are missing,want update function in java,1
2604,it is a good app but ideally it should give update user notification in days advance, want me to login with facebook,1
2605,it is a good app developer but it should give update and notification in quick advance,enable people to communicate with yahoo facebook,1
2606,it is a good app that google should give update notification in future,want to hide from facebook,1
2607,i can not log facebook in email to facebook,want remote access host video,1
2608,i certainly can just fit in to facebook facebook,want to actively access host video,1
2609,i can still not easily log it to compute,ability to access host youtube video,1
2610,host video playback is not available,want to access information,1
2611,host video is not publicly available,want to access information,1
2612,host video is not displayed,want people to access video,1
2613,i am not gay and get video, how to see profile picture,1
2614, i am unfortunately not able to get video,want to completely remove profile picture,1
2615,i still am not always able to watch video,want to manually remove profile picture,1
2616,i almost can certainly not remove my facebook profile but please resolve any issue,how to install app in china,1
2617,i certainly can also not remove if my profile picture please resolve this issue,want to also install an app in mobile,1
2618,we can not alter my profile picture but resolve this issue,ios app install app in mobile,1
2619,why this app is not exclusively installed exclusively in my phone ( google android ),fuck somebody to fuck you on self video,1
2620,why why this app is usually not installed in my phone ( see android ),everybody want to go turn on self video,1
2621, your app is not installed in windows phone ( android ),want to go on a video,1
2622,i were not able to switch on my phone,provide good app support for conducting online meetings and screen sharing,1
2623,i also were not able legally to switch on my video,good app for online online surveys and screen sharing,1
2624,but am not able to switch on my computer, app for conducting online meetings and screen tests,1
2625,"your app is amazing by meeting, screen sharing amongst many or more things in this app.",want to please put this background image on video,1
2626,"your app is amazing online meeting, screen sharing and many even more apps in this app.",how to put this image on video,1
2627,"this app is useful for meeting, file sharing and many many more things on this app.",want to put the image to video,1
2628,why to change video files?, receiving invalid password email or password message,1
2629,remember how to change your video background?,receiving the invalid email or password security message,1
