,texts,reason,label
6070,"shortly after the conference, the phone restarts automatically  and it lags very pretty much, even if though i have a very good phone.",want ta turn on orientation lock,1
6071,why can not i check in with my brother will be kidnapped but will be held in zoom custody,want to choke on my lock,1
6072,why can not i correct automatically when my daughter will be using remote sensing and will always be held to correct zoom correct,want them to remove background,1
6073,and why can not i check in with my daughter that will not be very remote and will be held in zoom correct,want to remove anything,1
6074,the test mode option does not currently work.,want us to remove background,1
6075,thus the static test mode does not work.,windows phone restarts automatically,1
6076,this test mode does not run.,phone taps automatically,1
6077,the audio communication quality is very poor 3.,phone restarts start automatically,1
6078,the communication system was poor 3.,want to check me in with his daughter,1
6079,the communication reception was poor 3.,just want to come check in with daughter,1
6080,the mobile app crashes every next 10 minutes.,unable to check in their daughter,1
6081,the plane crashes in 10 minutes.,test execution mode does not work,1
6082,the app crashes every ten seconds.,application mode may usually not work,1
6083,"several times i tried and enter the conference center, does one give, gives an error, i had to turn on the computer to send rogue.",test mode does not actually work,1
6084,"several times i tried to enter this conference link, does not give, gives no answer, i had another click on the pc to log in.",poor communication quality of communication,1
6085,"several times i tried to enter the conference link, but does still not always give, gives an encryption error, i simply had to turn on off the pc to go in.",poor quality of food,1
6086,"the sound is rattling, and wood sometimes cracks.",good quality of communication,1
6087,"this sound is rattling, rattling or loud echo sometimes louder.",app crashes every 10 minutes,1
6088,"the sound is rattling, while crying sometimes happens.",aircraft crashes every 10 minutes,1
6089,the app feels normal but i never crash remotely,app downloaded every 10 minutes,1
6090,the app is normal but otherwise i am often crash remotely,qualified to enter conference link,1
6091,the app is popular but does often crash remotely,want not to enter conference link,1
6092, the names of the participating group members change places.,want to enter a conference link,1
6093,the members of the group may change places.,sound is everywhere,1
6094,the names of the surviving group members often change places.,sound pollution is rattling,1
6095,not suitable for automatic machine learning,the sound is rattling,1
6096,not required for distance learning, app crashes remotely,1
6097,not suitable for distance machine learning,app crashes remotely,1
6098,"because of this app, unfortunately i can also not properly communicate with people properly",app crashes remotely,1
6099,"as of this app, i must safely communicate with people properly",group stage change meeting places,1
6100,"because users of this app, therefore i can not communicate with any people properly",group stage change places,1
6101,", i don't like watching that tv screen """,group winners change places,1
6102,", i honestly don't like watching the black movie screen """,technologies suitable for distance learning,1
6103,", you don't like watching the computer screen """,not currently suitable for distance learning,1
6104,i should hardly register tomorrow online lessons what to expect?,algorithms particularly suitable for distance estimation,1
6105,i can not register tomorrow tomorrow or what i do?,want us communicate with our neighbors,1
6106,girls can not register tomorrow online lessons what girls wear?,want to communicate with you,1
6107,i can absolutely not talk to both my team while while i am working.,want to communicate with everyday people,1
6108,he should not return to my team while i am working.,do not tap the touch screen,1
6109, i can not talk to my management team again while i am working.,we don't like the plain black screen,1
6110,the app scores are constantly getting lower and lower.,do nothing disturb the black screen,1
6111,the app scores scores are getting progressively lower and lower.,want to register for more online literacy lessons,1
6112,the app scores are getting lower overall and lower.,want to register schools for online learning lessons,1
6113,the default settings are not displayed directly on the screen.,want to register with online education,1
6114,the screen settings are typically not displayed on the screen.,want to help communicate with our team members,1
6115,the settings are not specified on each screen.,want to better communicate with your team members,1
6116,"the android ios version is not exactly the same, but it requires an updated update when the latest one is downloaded!",want ta work with team members,1
6117,"the android version is not technically the exact same, but it requires only an update when the latest one is downloaded!",app costs are still substantially lower,1
6118,"the original android version is technically not the exact same, it requires an update when the latest one is already downloaded!",app prices are getting lower,1
6119,its default values are terrible.,app stores are getting lower,1
6120,the default settings is unlimited.,settings were not displayed across the screen,1
6121,the default settings choices are usually terrible.,settings are not automatically displayed from the menu screen,1
6122,why am it impossible to split the screen between three parts whilst working in zoom?,settings are not displayed separately on either the screen,1
6123,why today requires rendering it impossible simply to split this screen into two parts when placed properly in vacuum?,this version is not the original,1
6124,then why is it nearly impossible enough to split the screen into two parts when working together in zoom?,this version is not the official,1
6125, how do do i switch to paid content?,windows version is not the android,1
6126,how much do i even switch to paid content?,all default settings are bad,1
6127, how do i even switch to paid content?,default settings are very bad,1
6128,", i never entered it, the code that cannot indeed even pass and hence it is not correct.",default default settings are bad,1
6129,", i entered it, though the code did indeed not yet pass and today it is not correct.",want to split screen into smaller parts and interested in zoom,1
6130,it contains a guarantee that you will not change and keep your sms in the chat,want to split everything into two parts when you properly zoom,1
6131,it is a pity that you can not manually change and automatically delete from your sms in the sms chat,developers want to switch websites to paid content,1
6132,it really is a pity thing that you absolutely can not change and delete from your sms in the chat,want to benefit from paid content,1
6133,"some remains believed that it is possible to share the biennial zoom conference in messengers telegram, whatsapp, switzerland.",want you to switch websites to paid content,1
6134,"google is inconvenient since it is impossible to share the annual google conference in google forum, whatsapp, etc.",he did not pass,1
6135,"however it is inconvenient that sometimes it is impossible simply to share the frequently scheduled annual zoom conference in messengers telegram, see whatsapp, etc.",code did so pass,1
6136,terrible application database management tools can not go to the lesson,code did not automatically execute,1
6137,terrible application process management can don't go to the lesson,want to completely delete sms,1
6138,terrible application management can also go to any lesson,want us to delete sms,1
6139,"when the code appears wrong, and is impossible to register",we want to delete sms,1
6140,"writes unless the code is wrong, therefore it is impossible to manually register",want to share annual conferences,1
6141,"writes byte code is unsigned, it is possible to register",want to share these conferences,1
6142,very bad image processing gets very dull.,you want to share zoom conferences,1
6143,very poor image quality gets very dull.,app management is bad,1
6144,the very bad image quality quality is very dull.,app management is integrated,1
6145,"since everything lags, it is nearly impossible to pass through solar system",app management is integrated,1
6146,"everything else, hence it seems impossible not to enter within the space",code is always wrong,1
6147,"everything lags, it seems impossible to solve our system",morse code is wrong,1
6148,"for uploading similar nothing shows is just a black lcd screen, and it is gross.",code is wrong wrong,1
6149,"uploading similar animation shows behind a black screen, saying it is gross.", image quality,1
6150,"uploading similar nothing but shows us just a plain black screen, and it is gross.",poor image processing,1
6151,"i finished editing it and once i entered the chat site again, the message i wrote just 3 seconds long ago yesterday was completely deleted and it keeps repeating 3 times, although it is still very annoying.",poor image resolution,1
6152,"i was leaving it alone when i entered your guest rooms, the text i downloaded 5 hours ago was completely deleted because it repeated 3 times, it is very annoying.",want to enter outside the boundaries,1
6153,"i was contemplating leaving it and wondering when i entered the phone chat again, because the text i wrote 5 seconds seconds ago was completely deleted and it repeated 3 consecutive times, it is very fucking annoying.",fail to enter the system,1
6154,hangs and watches when trying for start a conference,want you enter the system,1
6155,hangs and crashes when while trying to start planning a conference,live video shows onto screen,1
6156,hangs and crashes when trying to safely start a news conference,uploading files with black screen,1
6157,can not suck does not create regestration they generate when the moment registration is not available,constantly uploading video shows on black screen,1
6158,who can not suck or not simply choose whatever they can say and at that moment registration is not available,text is frequently deleted,1
6159,can any suck do you not create a regestration they say at the moment their solutions are therefore not available,original text is deleted,1
6160,"a connection error crashes, throws itself out on any application.",text element is deleted,1
6161,"a plane accidentally crashes, throws it out of the loop.",want to start a rugby conference,1
6162,"a binary error occurs, throws it out to the application.",ready to start a conference,1
6163," "" accidental "" development of russian programmers so that both customers and colleagues break their brains as if they worked for everyone",want to just start a conference,1
6164,"another "" brilliant "" development of brilliant russian animation programmers so that both students and teachers break their brains down as if realizing everything worked for almost everyone",they want something to create regestration,1
6165,"another "" remarkably brilliant "" development of russian programmers so profound that both students and the teachers break their brains as if forgetting everything ever worked for everyone",developers want to simultaneously create regestration,1
6166,specified as the real age writes that you can not actually enter the zoom zoom game without some kind of idea come up with and not a peeling,want not have regestration,1
6167,dave from real age writes that you can not afford the zoom game some form of come over with and not a peeling,driver error crashes,1
6168,microsoft specified for real pixel age writes because you can normally not enter the zoom window without needing any kind of come along with and not a peeling,cable connection error rate,1
6169,the quality is not just terrible cliffs quite permanent!,connection error detection,1
6170,the air quality is just terrible  cliffs permanent!,russian radio programmers are good,1
6171,the current temperature is just terrible and cliffs permanent!,russian programmers are unknown,1
6172,- android does also have any capability to create standalone open session rooms - on windows ( even with a dedicated display screen ) there is another way to open the participants window in parallel., russian programmers are good,1
6173,- oracle does not offer the option to create and open session built - on windows ( even via the large tablet screen ) there is no way to open the server window in parallel.,want us get into a game,1
6174,- android software does not always have the ability to create and open session rooms - even on android ( even with a large tablet pc screen ) there therefore is virtually no way to open the participants window remotely in any parallel.,want you to enter a game,1
6175,"no note, horizontal lines vertical lines appeared on the computer, they remain after the reboot, we do vaguely recall how to remove, there is nothing in the settings",want to watch a game,1
6176,"if please help, horizontal and vertical colored stripes are appeared on the computer, they remain after the reboot, i do have not quite know how to remove, because there is practically nothing in the settings", quality of cliffs,1
6177," please add help, horizontal and vertical stripes appeared on the apple computer, they remain after seeing the reboot, something i don't know how to remove, there is practically nothing hidden in the settings",extremely high quality of cliffs,1
6178,because computers can almost fully activate the system,poor geological quality of cliffs,1
6179,you can not blame the system,ios android does not have either the ability to manage and open session chat apps,1
6180,i can safely activate into the solar system,android does however not have the ability to create and run open session server rooms,1
6181,sound will not work in xiomi 10.,apache android does not have the capability that remotely create and open content sharing rooms,1
6182,sound does not work until xiomi 10.,want to remove horizontal and remove vertical horizontal stripes,1
6183,sound will indeed actually work on xiomi 10.,developers want to remove horizontal and diagonal striped stripes,1
6184,a poor application is sometimes necessary to verify the status after purchasing on a smartphone.,ability to remove vertical horizontal lines and lateral stripes,1
6185, a poor application is usually not necessarily able to manually update the software after copying from a file.,want to fully activate system,1
6186,a poor application provider is not usually able to update the status information after purchasing tickets on a laptop.,want to open system,1
6187,"it are also common practice to organize meetings over fairly short distances, but no one necessarily needs to go anywhere, and meeting in turn usually saves a lot of extra time saving time on the way and eventual outcome.",want your activate system,1
6188,"this is also convenient to organize meetings over long distances, whenever one wants to go anywhere, and this in turn saves a lot less time and effort in team organizing and preparation.",sound editing does not work on xiomi 10,1
6189,"there is quite convenient to hold these meetings outdoors over short walking distances, no one needs to go anywhere, overnight or camping in some turn saves their lot in time travel and additional effort on the way and preparation.",sound does not exist on episode 10,1
6190,"through the smart phone, the application is silent ( uninstalling off the previous application and downloading and a potentially new installation did otherwise not fix up anything ).",sound does still always work properly on xiomi 10,1
6191,"downloaded through the phone, usually the application is temporarily silent ( uninstalling the application and subsequent downloading and creating a new installation did not fix virtually anything ).",check google update status after purchasing a laptop,1
6192,"under a protocol, every application is silent ( uninstalling the application and downloading and a new installation will not fix that ).",subject to update status after purchasing the laptop,1
6193,but mike never pressed the microphone button.,organisation for women organising long distance bike meetings,1
6194,unfortunately we never found the microphone button.,good for amateurs organising long distance race meetings,1
6195,but i never found this damn microphone off button.,very good for runners organising long distance meetings,1
6196,the program itself constantly crashes when the broadband internet is stable., the whole application  did not fix ,1
6197,however the program constantly crashes when the entire internet is stable.,uninstalling the linux application did not fix virtually anything,1
6198,the program almost constantly crashes when the whole internet is stable.,uninstalling android application did not fix anything,1
6199,"i lost access on a social organizer twitter account, the facebook pro plan.",want somebody to find microphone button,1
6200,"i lost access due under the online organizer plan, the pro bono plan.",just want to find that button,1
6201,"i lost access permission to open my personal organizer account, the pro plan.",want to find another microphone button,1
6202,users accidentally disabled email links in all the settings.,software crashes when the internet remains stable,1
6203,accidentally disabled email address authentication in the default settings.,website crashes when the internet is blocked,1
6204,accidentally disabled optical links in the settings.,broadband crashes when broadband internet is stable,1
6205,authorship is impossible to determine.,lost link to organizer account,1
6206,it becomes impossible without synchronize.,lost access to twitter account,1
6207,it is impossible now to properly synchronize.,users lost access to organizer account,1
6208,the sound received in using the wireless headphones falls off intermittently periodically for about 1 - 2 minutes.,accidentally disabled email authentication function in the default settings,1
6209,usually the sound in the standard wireless headphones normally falls shut off intermittently for 1 - 2 minutes.,accidentally disabled email server authentication function in the settings,1
6210,the background sound in the portable wireless headphones continuously falls off intermittently for 1 - 2 consecutive minutes.,accidentally trigger data authentication in the settings,1
6211,they simply can also not find properly saved broadcasts.,i want you to know,1
6212,i can not yet find my newly saved broadcasts., want to better synchronize,1
6213,i did not find our saved broadcasts.,want algorithms to better synchronize,1
6214,i just could not let him escape from the android., sound quality in wireless headphones is off intermittently,1
6215,i just deliberately did so not just let me connect from the android.,sound in analog headphones is emitted intermittently,1
6216,i honestly really really did not really let me connect onto the android.,sound in wireless wireless headphones audio are generally intermittent,1
6217,"though so far, we have not added the ability to remotely log in using qr code, as a logical result, having one separate laptop and possibly five different accounts, there is no quick automatic change of account",want to go find saved broadcasts,1
6218,"if so thus far, we have not added onto the ability to log in using qr source code, as a result, one virtual laptop and possibly five different accounts, there is no quick change of the account",want to find saved tv broadcasts,1
6219,"so far, we have successfully added the ability to edit emails using any qr error code, as a logical result, despite one hundred laptop users and across ten different accounts, which is no quick update of password",want to find saved television broadcasts,1
6220,"using unclear secure encryption systems, etc.",ability to connect from android,1
6221,"quantum microwave optical encryption systems, etc.",want to easily connect from android,1
6222,"optical encryption schemes, etc.",want to read from android,1
6223,i can not ever go back through facebook and facebook was all forgotten ,want can generate login using php template code,1
6224,unfortunately i absolutely can not go through facebook and everything really was fine before,want visitors could learn using qr source code,1
6225,i honestly can still safely sort through facebook pages and nothing was fine before, to start using qr code,1
6226,i can not install the german wikipedia,the unclear encryption algorithm,1
6227, i can not reproduce the existing russian version,an unclear encryption system,1
6228,since i can not install from the russian version,unclear identity encryption system,1
6229,but one can not register as a child,want to connect with facebook,1
6230,but i certainly can not legally register as a student,want to return to facebook,1
6231,but she can not register as a child,want to personally connect to facebook,1
6232,the mail service does not currently work for them.,want to officially install russian version,1
6233,the mail does indeed pay for them.,want me to install russian version,1
6234,the mail don't work against them.,want to install russian flag,1
6235,you can not log in to your own google maps account automatically without a browser, tae register as a student,1
6236,you can not plug back in to their default google account before installing a browser,want to graduate as a student,1
6237,you can not directly log in to your google account without installing a mobile browser, want to legally register as a student,1
6238,i can still not easily get into the chat room many times,permission to receive mail,1
6239,i don't get into the chat room many hours,want me to receive mail,1
6240,i don't break into the chat room many times,want not receive mail,1
6241,"fraudulent software, fake web service.",want you live without browser,1
6242,"bad good software, bad good web service.",want a login without knowing,1
6243,"google bad blog, bad web browser etc.",want anyone to login without google browser,1
6244,he will continually improve on high - end equipment,want internet access chat room,1
6245, therefore needs more concentrated on manufacturing high - end equipment,want to access a chat room,1
6246,he urgently needs to improve on high - end electronic equipment,want you to access chat room,1
6247,i just don't know how to meet with google if you guys can.,web app bad bad,1
6248,i don't even know how to meet google if only you still can.,web app big bad,1
6249,i will still know how to use google if you can.,web app is available,1
6250,"since last i updated, i can not easily enter on some links.", to rely on high - end equipment,1
6251,"since i updated, however i still can certainly not enter some links.",aims to improve on high - end markets,1
6252,"since i know, i can also locate some links.", want customers to improve on high - end equipment,1
6253,"you did not put it from my cell, that provides the only detail",unable fail to meet google,1
6254,"although i can certainly not even put emojis from my cell, that is the only useful detail",unable currently meet google google,1
6255,"i can practically put emojis from my cell, that being my only reason",unable otherwise meet google,1
6256,"hello, i would like we might put yourself onto a cell phone phone because matthew bourne had already did it for xd",want to enter google links,1
6257,"hello, and i would like inviting you to put wallpaper for your cell phone because my mett has already did it xd",want to enter heaven,1
6258,"hello, i would like you to put it for cell phone because mett just got triple x",you want to enter links,1
6259,today it is a good app for korean lesson lessons,want me to help put emojis on cell,1
6260,it really was a pretty good book for korean lessons, to put emojis in cell,1
6261, it is a relatively good app for korean lessons,want to put emojis directly around each cell,1
6262,i need it to be able to download the application x procedures before you have to download,want money put up for cell phone,1
6263,i want it to be physically able to download the application x procedures that i have programmed to currently do,want to buy wallpaper for cell phones,1
6264,just need it to be faster to download the triple x procedures that i wanted to do,want ta put wallpaper into cell phone,1
6265, try not let me connect my android tablet'em camera,good for korean history lessons,1
6266,will not let me connect with tablet'm camera, good for piano lessons,1
6267,will not let me connect using my tablet's digital camera,good morning korean lessons,1
6268,"until today the ios app has worked out very reasonably well, the image playback quality is very good.",want the android devices to become built faster,1
6269,"until today the app has worked up very well, the visual image quality rating is generally very good.",want the app should be compatible,1
6270,"until today when the latest app has worked very well, the latest image quality software is very good.",want the ios app to always be faster,1
6271,10 / 10 can they also have my classes shared with parents concerning teacher and student quality,ability to connect to camera,1
6272,10 / 10 can really have many classes under my teacher and good quality,want to connect cameras to camera,1
6273,10 / day 10 can i repeat all my classes done with my teacher with good quality,software to connect to camera,1
6274,"passwords are normally saved on the host device, i don't necessarily need anyone to be putting the password down every time and much less updating.",app has good image image quality,1
6275,"passwords are stored via the device, i don't need you be checking the password every month and much less updating.",app for good image quality,1
