,texts,reason,label
4223,"hopefully unless you pass the edge authentication, hopefully you would not get fully able legally to open it.",want option for host / co - host to assign additional participants when viewed using android ipad,1
4224,do not really change settings like background picture files until i really get stuck in a folder,android unmutes automatically when switching between breakout apps,1
4225,can not randomly change settings exactly like background or picture until i am already in a meeting,software unmutes automatically when switching to breakout rooms,1
4226,people can not change settings like background picture screens until i am already in for a meeting,app activated automatically when switching into breakout rooms,1
4227,everything is good but in the spanish version it is bad.,want to use zoom,1
4228,everything is good but repeating our same thing this is misspelled.,want to go zoom,1
4229,everything seems similar but in japanese emoji character symbols is misspelled.,want not use zoom,1
4230,"button removal on the active and mute keys makes an app appear more streamline, but we need the name and display status back ( function over appearance )!",you want to change settings like background in picture,1
4231,"the removal of the names and address status ensures these messages appear more streamline, but we need the names for mute priority back ( priority over appearance )!",users want to change screen settings like background picture,1
4232,"the details of the names and mute status in our app appear less transparent, but we need the names and mute status buttons ( function plus appearance )!", allows readers to change colors like background picture,1
4233,why can not help i stream my email meeting to my apple messenger tv.,emoji type symbols below are misspelled,1
4234,so why can not i stream my meeting address to my apple messenger tv.,auxiliary verbs are misspelled,1
4235,why why can not i simply stream through my meeting to my apple tv.,unicode emoji symbols are occasionally misspelled,1
4236,birthdate change will affect load.,remove names and address status,1
4237,birthdate pregnancy information files will not load.,want to stream meeting on cable tv,1
4238,birthdate information don't reveal.,want to freely stream their meeting to apple tv,1
4239,re : mobile. really terrible design just launches you into business without giving you a preview of yourself which has caused me can suddenly enter a meeting with texts or audio messages in your phone.,want to stream videos via apple tv,1
4240,re : mobile. really terrible design that launches invites you into meetings without really giving you a preview of seeing yourself which has caused me today to suddenly enter a meeting with video screens and audio logged on in all the days past.,birthdate information sources vary load,1
4241,re : mobile. really terrible design that brings you into meetings without giving yourself a preview of yourself which somehow caused me to illegally enter a meeting using video controlled motion cameras in the past.,birthdate date did not load,1
4242,apps all around app except it does not support microphone access with the version 4 of google pro.,birthdate information will generally not affect load,1
4243,great all fit ios app except when it does not give extra functionality with the version plus 5 of apple ipad pro.,want to get excited before joining facebook,1
4244,great all apps itunes except it does only give microphone access from the version 1 of ipad pro.,want to get together and finally joining a meeting,1
4245,poor performance in ultra weak carrier signal areas,want me get another preview before joining any other,1
4246,very poor performance performance in weak signal areas,ipad pro version needs additional microphone microphone access,1
4247,poor performance in weak digital signal coding areas,ipad pro desktop version needs microphone remote access,1
4248,cisco can not turn off two step data authentication.,ipad pro pro version needs full web access,1
4249,can not turn up two different authentication.,poor performance improvement in weak rf signal areas,1
4250,can not cut down two step authentication.,poor performance for weak rural areas,1
4251,not quite a very smooth sign up either.,poor cpu performance in weak signal processing areas,1
4252,not that smooth guy showed up today either.,want ta turn off two lights authentication,1
4253,not a very popular sign up here either.,want to turn off all step ways,1
4254,they cannot just take your birthdays ( i am adult ) and does not have me sign up,lets us turn off two step authentication,1
4255,they do cannot celebrate my birthdays ( i am adult ) and can not see me sign up,sign up experience this is bad,1
4256,they don't take off my birthdays ( unless i am adult ) and does not let anyone me sign it up,my fucked up experience is bad,1
4257,phone calls may drop all during the time,sign language experience is bad,1
4258,phone calls always drop all the same time,want to sign back up facebook for birthday bash,1
4259,those phone calls would drop all the time,want to sign me up for 10th birthday account,1
4260,my youtube image stopped after 15 min.,want your wake up for birthday account,1
4261,my zoom image conferencing process stopped after 15 full minutes.,phone numbers drop at the time,1
4262,my 3d zoom camera conferencing stopped functioning after 15 minutes.,phone line calls will drop all the time,1
4263,i really am trying to actually film my youtube video and they can hopefully really let me forever be on there,phone calls drop all times the next time,1
4264,i am trying to film my youtube page saying you will not let me go on forever,zoom mobile conferencing services stopped after 15 minutes,1
4265,me am trying to film a youtube video and it may not let me stay on there,google zoom conferencing starts immediately after 15 minutes,1
4266,web interface and the code that guys sent me does not even exist,zoom trains stopped every 15 minutes,1
4267,bad interface and using the language anyone could write for me does not not even work,want to record this video,1
4268,bad interface and the code which you said guys already sent me does not even work,want to go record youtube video,1
4269,add arabic to the ios application,unable to record youtube video,1
4270,add arabic to the ios application,interface if not good,1
4271,add additional functionality throughout the application,life is not good,1
4272,arabic language script does not exist,the interface is not good,1
4273,arabic language does not apply,add multimedia content to the curriculum,1
4274,arabic language does not presently exist,add hello and write the application,1
4275,but it clearly does not not support this language..,applying arabic to the application,1
4276,but java does not support arabic syntax..,arabic language does not not exist,1
4277,but today it does not support another arabic language..,iranian arabic language does not exist,1
4278,excellent environment for software development.,arabic language does still exist,1
4279,provides excellent tool for rapid personal development.,perhaps you could use arabic language,1
4280,excellent training in personal development.,licence to use arabic language,1
4281,quality and portuguese subtitles are completely missing!, to use arabic language,1
4282,quality portuguese copies remain missing!,good for personal health,1
4283,quality of portuguese subtitles are still missing!,good for sustainable development,1
4284,you also need automation to make it possible to manage all the simultaneous rooms through the application.,institute for personal development,1
4285,you need to make it easy to manage virtual guest rooms through the application.,both subtitles are currently missing,1
4286,you need always make it difficult to manage the patient rooms through the application.,both english subtitles are missing,1
4287,"every application is missing backgrounds, therefore is very rare.",both subtitles are missing,1
4288,"the mobile application is missing many backgrounds, because this is very bad.",want to manage its multiple rooms,1
4289,"the java application uses often missing backgrounds, but this proves very bad.",want to help manage multiple rooms,1
4290,i can not possibly leave before the class finish,want to manage multiple chat rooms,1
4291,i really can not attend the last class ,app is missing app,1
4292, did not leave the class finish, is missing backgrounds,1
4293,the mouse icon menu does not let me access this text icon.,app is missing all backgrounds,1
4294,the new icon menu does just let me access the default icon.,want us to leave class,1
4295,the new icon user icon does also automatically let for me access the default file.,want to take class,1
4296,you will do may not have only the possibility to add a wallpaper to the free version,you want to leave class,1
4297,you don't have the ability to convert a wallpaper to a free version,want remote access text box,1
4298,you don't have the possibility to manually add either a wallpaper to the free software version,want to see text box,1
4299,"it however is unacceptable that it is therefore not possible only to directly mirror the image and audio natively in the application, if you want to use an existing android device and mirror the video to see the tv on your google chrome cast you also can only be able to use the google home app but the audio content does not mirror, it is muted useless and ridiculous!",want to access this box,1
4300,"it is unacceptable because software is not possible to mirror an image and audio natively in the iphone, if you want to use an android phone and mirror the video or the tv on google apps cast you can only be able to use the google apps app but the audio does not mirror, it is distorted and distorted!",want to add wallpaper for free version,1
4301,"it is unacceptable fact that it is therefore not entirely possible physically to mirror either the image and audio natively in the application, if you want physically to use an android android device and mirror the video to the tv on google chrome cast you can only be able physically to actually use the google home app but the audio does not mirror, it itself is muted and ridiculous!",want me bring wallpaper to free version,1
4302,super easy to compare with youtube to google live!,want users to add wallpaper to pdf free version,1
4303,super hits easy to connect with youtube to make music live!,want to mirror our audio and visual video,1
4304, i therefore can not hold any meetings!!,want to make mirror audio clips and video,1
4305,now i can not hold these any meetings!!,smash your mirror audio and video,1
4306,surely i still can not hold any prisoners!!,good for users connecting with youtube,1
4307,the new xbox mobile update feature was horrible!,good for users connecting with youtube,1
4308,the whole new mobile update was really horrible!,especially good for connecting with youtube,1
4309,the new pay phone was horrible!,want them to hold meetings,1
4310,i could hardly open the nephew'n baby shower.,want to hold me,1
4311,i could only open my mother's baby eyes.,want to skip meetings,1
4312,i could not open my beloved nephew's giant baby bath shower.,latest update was bad,1
4313,the different price varies every month.,mobile browser update was bad,1
4314,a different calendar comes next month.,mobile phone was bad,1
4315,a different admission price comes here every month.,want ta open the baby shop,1
4316,i am still restricted to 5 stars yet because what is most lacking is the desire to skip their events and place participants in them.,just want me to open the baby shower,1
4317, i am not going to 5 guest stars yet because what is currently most lacking today is the easy option to open simultaneous rooms and place participants interested in them.,want to start the electric shower,1
4318,i am not going to 5 stars tonight yet because what i is probably most lacking is the option to open multiple simultaneous chat rooms and place other participants in them.,different prices that come every year,1
4319,many limited available features in including the tablet version,gasoline prices come every month,1
4320,adds many limited access features in the tablet version,electricity prices come every month,1
4321,many limited hardware features in upgrading the tablet version,want can open multiple rooms simultaneously,1
4322,it unfortunately would not work correctly properly working on the tablet!,want can open multiple rooms simultaneously,1
4323,it does don't really work properly except on multilaser tablet!,want you to open multiple rooms simultaneously simultaneously,1
4324,translation does not work properly upon this tablet!,tablet navigation has limited navigation capability,1
4325,"on the smartphone camera there is no way necessary to configure it to brighten up the camera, the video is almost very completely dark, the settings on the camera phone are very limited, in the end i only use it, because there is obviously still no other feature, etc but when it really does not improve, i will only uninstall it",tablet version 2 has limited features,1
4326,"on the smartphone there really is no way to configure it to constantly brighten off the camera, the video is always very dark, the settings on on the phone screen are very limited, in the end i can only use it, because there is still no other navigation feature, but when done it usually does not improve, i will uninstall it",tablet os has limited features,1
4327,"on the smartphone there is no way to configure using it to brighten on the rear camera, the video is always very dark, the settings on the phone are very limited, in the end i only use it, because there is really still no other feature, etc but so when it itself does not significantly improve, i will uninstall on it",will want you to use multilaser tablet,1
4328,"it is reasonable, i have an inherent problem, because zoom password does absolutely almost immediately recognize my email password, therefore i did not automatically create my meeting call room",patients ta use this multilaser implant tablet,1
4329,"it is reasonable, to have no account number, zoom does not recognize the email password, so i can not visit another meeting room",ready to use multilaser tablet,1
4330,"password is quite reasonable, but cannot have experienced an account problem, zoom and don't recognize a correct email or password, therefore i can not create my meeting address",want no change settings,1
4331,our excellent app saves our mental and emotional faculties beyond the professional, to change settings,1
4332,excellent quality saves our mental and emotional faculties from the professional,want to change ,1
4333,excellent app saves our emotional and emotional faculties beyond a professional,microsoft does not recognize email account password,1
4334,probably worst app ever seen selling chinese products which are just made for show but not of use,app store does not recognize email name and password,1
4335,worst chinese app ever ever seen chinese products are really just made for show but not of use,app store don't recognize email and email password,1
4336,worst app ever seen chinese products are just not a show but worthy of use,good for physical and emotional stability,1
4337,why can should i edit meeting settings on an app?,good for pediatric mental disorders and emotional management,1
4338,why can not i adjust user settings via mobile app?,good for mental hygiene and emotional health management,1
4339,why can not let i edit meeting user settings available from mobile app?,poor quality of chinese food,1
4340,"and that too the pop button up will probably not close even after another tapping on the "" x "" button button.",poor quality of quality chinese products,1
4341,"button ensures that too the pop up will not close properly after repeatedly clicking if only the "" node x "" switch.",poor quality of chinese food products,1
4342,"and that too the bottom up will not close even after tapping on a "" hello "" key.",used to edit meeting settings,1
4343,it uses pretty much bandwidth and you still will fairly easily lower down the video quality,want to manually edit meeting settings,1
4344,it uses very much data density and so you can not lower the video file quality,want to edit meeting rooms,1
4345,it uses very much data and hence you can not lower than the video compression quality,"pop up will still close even after touching the "" x "" button",1
4346,"it should have been a good ios app, it help me guys get along with your family and friends","pop up will not close automatically after a pressing button on "" x "" button button",1
4347,"it have been a good app, can it help make me get along with your family mates and friends","this pop button up will not close even after manually tapping on "" x "" button",1
4348,"it have always been a fairly good app, it help me get myself along nicely with family and friends",data consumption is high and unable properly to adjust video signal quality,1
4349,because it always needs only an update the sound system is terrible,data consumption is incomplete or unable to adjust video quality,1
4350,it always urgently needs an update the internal sound system is terrible,data consumption is high but unable adequately adjust video quality,1
4351,whoever always needs an alarm the sound system is terrible,feel good for family and friends,1
4352,good news apps business study and entrepreneurship conference,good neighbor family and friends,1
4353,good apps for travel abroad conference,good for family and good friends,1
4354,good apps student study and teaching,the sound system provides an additional,1
4355,"i use you to use zoom on both my tablet pc and mobile phone with this same mobile account in same time, so it very very easy to switch between your device and its very useful.",sound system needs an external update,1
4356,"smartphone user want to use android zoom app on your tablet my tablet tablet and smartphone with same account in same calendar time, so it seems easy to switch between apps and so be very useful.",sound system automatically needs an update,1
4357,"i use to use zoom on board both my tablet phone and android mobile with same account settings in that same cpu time, so it are very easy to switch between device and its very useful.",good software apps for study sessions and conference,1
4358,"linking does not always really work properly for some reason, and you certainly can not quite easily copy and send the meeting invite for information.",good news online study and conference,1
4359,"linking did not always work for one reason, and you can more easily copy and send your meeting invite email.",good web apps for study and networking conference,1
4360,"billing does not always happen for some reason, and clients don't easily copy and send the meeting date information.",ability required to use google zoom on mobile and tablet,1
4361,i uninstalled an online store yet it is still still on the update list?,improved ability to use 3d zoom on mobile and tablet,1
4362,has already uninstalled this list and as yet it have still appeared on in my google watch list?,ability to use zoom zoom smartphone and tablet,1
4363,had i uninstalled this mobile app and app that is now regularly appeared on google my update list?,want to copy and attend paste meeting invite contact information,1
4364,when connecting over 10 or more people connection frequency transmission starts to become slow.,want to copy or organize meeting invite information,1
4365,while connecting between 10 people or more people people connection frequency is to slow.,want to manually copy and edit paste meeting invite information,1
4366,transmission while connecting 10 or more people connection frequency is guaranteed to stay slow.,uninstalled mobile app and yet it appears not on the update list,1
4367,very difficult to create meeting rooms,uninstalled google mobile app and still technically it is still still on the update list,1
4368, easy to create web links,uninstalled google app and yet it is still in google update list,1
4369,very easy to observe meeting conditions,connecting 10 or more routes is to connect,1
4370,easy to connect board members.,connecting 3 or more people is to communicate,1
4371,more easy to connect members with members.,connecting 10 minutes or more people is required to slow,1
4372,continues to associate with members.,easy to create online meeting links,1
4373,i hate this iphone app becouse this app don't have bad background & filters, to create meeting links,1
4374,we absolutely hate letting this app and this mobile app don't have background & password,easy tools create meeting links,1
4375,i hate this blackberry becouse iphone app don't have background & color,good for connecting with others,1
4376,phones have a very important meeting because nokia zoom does not count on my brand new nokia samsung zoom nexus smartphone,good for connecting themselves with others,1
4377,i missed a very important event since zoom does not count on my new nokia galaxy phone,good for connecting students with members,1
4378,i just missed a very important meeting because zoom connectivity does not work out on my favorite new samsung galaxy phone,android app does however not have background & filters,1
4379,bluetooth sensor setup is poorly done.,app does also have background & color,1
4380,bluetooth headset repair is currently done.,app does indeed not necessarily have background & filters,1
4381,bluetooth headset configuration optimization is poorly commercially done.,you want to use zoom cameras on cell phone,1
4382,but its light is a bit bit too bright,you want to use digital zoom on cell phone,1
4383,but your ui is a shade too bright,want t use zoom on cell phones,1
4384,but ui gets a lot too laggy,bluetooth network optimization is typically poorly properly performed,1
4385,the new dynamic zoom camera feature which enables us viewers to shift to other pages while still still keeping the video on is extremely awesome.,bluetooth headset activity is poorly documented,1
4386,a new multimedia feature which allowed users to shift to other pages while still keeping the video on is updated.,bluetooth ip headset optimization is typically poorly done,1
4387,add the latest new zoom feature which enables allow us easily shift to multiple pages simultaneously whilst still retaining a text stream on is awesome.,pdf / ux is slow,1
4388,"it never stops, icons but sometimes handy, it joins by numbers as usual.",linux ui / os ux is slow,1
4389,"it never stops, icons are not handy, it always joins it by viewing video playback as default.",xml http / ui ux is slow,1
4390,"it seldom stops, but icons are usually not too handy, it never joins by video as needed.",new gps tracking capability is good,1
4391,"could have been 5 star but for few technical glitches - some players are unable to use background blurring  sometimes, sometimes some users join some meetings.",this new zoom feature is good,1
4392,"this could theoretically easily received 5 star reviews albeit for surprisingly few minor glitches - unfortunately some gaming devices are unable and use excessive background blurring and sometimes, quite difficult users join some meetings.",new zoom photography is good,1
4393,"users could have was given 5 star awards but for few cases minor background glitches - some devices which are unable to use background blurring and sometimes, quite difficult ones to join some meetings.",static icons are not supported,1
4394,i guess zoom is still excellent'still keeping the same'but already let even me break down.,icons are often not useful,1
4395,i feel zoom is excellent'zoom still feels the real same'has not let me sit down.,icons are not included,1
4396,i feel it is excellent'still the same'has already gotten me know.,adopt a blur background and even join regular meetings,1
4397,very much annoying not being able to get a full full screen satellite view.,want to periodically blur background checks and join meetings,1
4398,very very annoying not considering being able to get a full wide screen view.,want not blur background or join meetings,1
4399,very bad not being able of get a full aerial view.,zoom performance very good,1
4400,zoom does not cater with mobile users., zoom performance  good,1
4401,zoom does not apply to android users.,zoom performance is excellent,1
4402,zoom mobile does does not cater for android users.,users able to get full google internet view,1
4403,i am now able to customize any vertual background request you to please look into me.,i want pictures to get full screen view,1
4404,we am not able to resist my vertual background request only to kindly look into yours.,we want to communicate under full screen view,1
4405,and i am not able to legally customize unless my vertual background request you to kindly look into doing this.,zoom does likewise cater with android users,1
4406,it also generally can not keep tabs on monthly recurrent shareholder meetings,zoom does only cater for any android users,1
4407,it has also currently can not keep strict tabs on recurrent meetings,we strive to preserve vertual background,1
4408,however it also can sometimes not keep tabs fixed on recurrent meetings,attempts to avoid vertual background,1
4409,the person posting logged pictures via google zoom using mobile chat can automatically see files in print.,want to carefully customize a vertual background,1
4410,the person being logged in zoom using mobile would not download files in chat.,want ta drop tabs on recurrent meetings,1
4411,sometimes the person responsible who logged in zoom using mobile apps can not see files in chat.,you want to just keep tabs on recurrent meetings,1
4412,zoom is really so slow please tune it up  please!,you ta keep tabs on these recurrent monthly reports,1
4413,zoom it is so slow to tune us all up now!,click to see files on chat,1
